{"budget":{"budgetVersion":"strata-profile-budget-v1","estimatedCpuWorkUnits":3072,"estimatedRetainedBytes":2432,"globalCellCount":3072,"maximumCanonicalBytes":131072,"maximumLayersPerProfile":16,"maximumProfiles":256,"maximumStackThicknessBlocks":512,"maximumTotalLayers":1024},"canonicalChecksum":"855d0c31cdee2160e8fadb16f4691cfde9ade5026cadcab298eea36995996b02","hydrologyHandoff":{"bindingVersion":1,"inputMode":"SURFACE_EXPOSED_STRATA_SCALARS","sourceGeologyPlanChecksum":"8bc24842fd23808cc0498279e4f2cca8000d66e9adf6f73d34f1ad92a6ea01e5","sourceHydrologyPriorChecksum":"a516011407c20c6931961bb752cda6c1f73619af2a2faa51e2a3bfa2ae21d142","sourceLithologyPlanChecksum":"69382c8a3256a678884394546d56868961aca6a5f025913bdc894d2952f46d78","sourcePriorKind":"UNIFORM_GEOLOGY_PRIOR","sourceReconciliationAlgorithmVersion":"hydrology-reconcile-fixed-v1","transitionMode":"EXPLICIT_VERSION_TRANSITION"},"planVersion":1,"profileContractVersion":"strata-profile-contract-v1","profiles":[{"formationCode":1,"formationId":"formation.uniform-prior","layerOrder":"BOTTOM_TO_TOP","layers":[{"layerIndex":0,"lithologyCode":1,"lithologyId":"lithology.hard-intrusive","thicknessBlocks":64}],"orientation":{"dipAzimuthDegrees":0,"dipDegrees":0,"foldAmplitudeBlocks":0,"foldWavelengthBlocks":0,"tiltDxMillionths":0,"tiltDzMillionths":0},"profileId":"strata-province-uniform-prior","provinceCode":1,"provinceId":"province-uniform-prior"}],"sourceGeologyPlanChecksum":"8bc24842fd23808cc0498279e4f2cca8000d66e9adf6f73d34f1ad92a6ea01e5","sourceLithologyPlanChecksum":"69382c8a3256a678884394546d56868961aca6a5f025913bdc894d2952f46d78"}